{
  "agent": null,
  "answers": [],
  "approval": null,
  "arguments": {},
  "asked_at": "2026-09-24T00:00:00Z",
  "blocks": [],
  "decided_at": null,
  "decided_by": null,
  "details": [],
  "env_var": null,
  "expires_at": null,
  "id": "Q7",
  "item_version": 1,
  "kind": "question",
  "notes": [],
  "options": [],
  "pipeline": null,
  "pull_request": null,
  "question": "CLI only, or also the IDE, the cloud agent and code review?",
  "rank": 40,
  "recommendation": "CLI only.",
  "recommendation_source": null,
  "revision": null,
  "stage": null,
  "status": "pending",
  "title": "Copilot scope (governs 1.1)",
  "tool": null,
  "topic": "scope",
  "waits": "M7"
}
