{
  "agent": null,
  "answers": [],
  "approval": null,
  "arguments": {},
  "asked_at": "2026-09-25T00:00:00Z",
  "blocks": [],
  "decided_at": null,
  "decided_by": null,
  "details": [
    "In your own terminal on the host, logged in to `gh` as yourself (never in an agent session), from the main checkout:",
    "`just github-labels --dry-run` reads the public label list with no credential and prints what would be created or updated;",
    "`just github-labels --apply` creates and updates them with your own `gh`, reads them back, and never deletes a label the file does not declare."
  ],
  "env_var": null,
  "expires_at": null,
  "id": "S9",
  "item_version": 1,
  "kind": "step",
  "notes": [],
  "options": [],
  "pipeline": null,
  "pull_request": null,
  "question": "Apply the labels of `.github/labels.yml` once, then again whenever the file changes.",
  "rank": 90,
  "recommendation": null,
  "recommendation_source": null,
  "revision": null,
  "stage": null,
  "status": "pending",
  "title": null,
  "tool": null,
  "topic": "steps",
  "waits": "M2 (the issue forms name these labels; GitHub drops a label that does not exist)"
}
