{
  "agent": null,
  "answers": [],
  "approval": null,
  "arguments": {},
  "asked_at": "2026-09-24T00:00:00Z",
  "blocks": [],
  "decided_at": null,
  "decided_by": null,
  "details": [],
  "env_var": null,
  "expires_at": null,
  "id": "Q14",
  "item_version": 1,
  "kind": "question",
  "notes": [],
  "options": [],
  "pipeline": null,
  "pull_request": null,
  "question": "create a machine account (for example `tac-bot`) with write access and no admin, or a GitHub App, for agent pushes. Then turn on \"no bypass, including admins\" for the default branch, and run `tac github apply`. The owner's own `gh` login stays the owner's and never enters an agent session.",
  "rank": 10,
  "recommendation": "a machine account with a fine-grained token scoped to this repository.",
  "recommendation_source": null,
  "revision": null,
  "stage": null,
  "status": "pending",
  "title": "agent identity",
  "tool": null,
  "topic": "identity",
  "waits": "M0"
}
