{
  "agent": null,
  "answers": [],
  "approval": null,
  "arguments": {},
  "asked_at": "2026-09-24T00:00:00Z",
  "blocks": [],
  "decided_at": null,
  "decided_by": null,
  "details": [
    "In your own terminal on the host, logged in to `gh` as yourself (never in an agent session), from the main checkout, with the machine account named in Q14 in place of `tac-bot`:",
    "`uv run --frozen --no-sync --project .agents tac github apply --dry-run` prints the ruleset without calling GitHub;",
    "`uv run --frozen --no-sync --project .agents tac github apply --bot tac-bot` checks the account has write and no admin, then creates or updates the ruleset and reads it back by id;",
    "`uv run --frozen --no-sync --project .agents tac doctor` must then show `github-ruleset` as PASS."
  ],
  "env_var": null,
  "expires_at": null,
  "id": "S4",
  "item_version": 1,
  "kind": "step",
  "notes": [],
  "options": [],
  "pipeline": null,
  "pull_request": null,
  "question": "After Q14: run `tac github apply`, then `tac doctor`.",
  "rank": 40,
  "recommendation": null,
  "recommendation_source": null,
  "revision": null,
  "stage": null,
  "status": "pending",
  "title": null,
  "tool": null,
  "topic": "steps",
  "waits": null
}
