{
  "agent": null,
  "answers": [
    {
      "at": "2026-09-25T00:00:00Z",
      "basis": "owner-via-chief",
      "by": "tpetedb",
      "link": null,
      "text": "outside the repository, see [docs/adr/0002-owner-decisions-2026-09-25.md](docs/adr/0002-owner-decisions-2026-09-25.md)."
    }
  ],
  "approval": null,
  "arguments": {},
  "asked_at": "2026-09-24T00:00:00Z",
  "blocks": [],
  "decided_at": "2026-09-25T00:00:00Z",
  "decided_by": "tpetedb",
  "details": [],
  "env_var": null,
  "expires_at": null,
  "id": "Q17",
  "item_version": 1,
  "kind": "question",
  "notes": [],
  "options": [],
  "pipeline": null,
  "pull_request": null,
  "question": "outside the repository, or at the root, gitignored?",
  "rank": 30,
  "recommendation": "outside the repository, which is safer against `git add -f`.",
  "recommendation_source": null,
  "revision": null,
  "stage": null,
  "status": "answered",
  "title": "agents.env location",
  "tool": null,
  "topic": "profiles",
  "waits": "M0"
}
