{
  "agent": null,
  "answers": [],
  "approval": null,
  "arguments": {},
  "asked_at": "2026-09-24T00:00:00Z",
  "blocks": [],
  "decided_at": null,
  "decided_by": null,
  "details": [],
  "env_var": null,
  "expires_at": null,
  "id": "S8",
  "item_version": 1,
  "kind": "step",
  "notes": [],
  "options": [],
  "pipeline": null,
  "pull_request": null,
  "question": "Once pi is enabled (1.1): trust the project in pi once.",
  "rank": 80,
  "recommendation": null,
  "recommendation_source": null,
  "revision": null,
  "stage": null,
  "status": "pending",
  "title": null,
  "tool": null,
  "topic": "steps",
  "waits": null
}
