{
  "agent": null,
  "answers": [],
  "approval": null,
  "arguments": {},
  "asked_at": "2026-09-24T00:00:00Z",
  "blocks": [],
  "decided_at": null,
  "decided_by": null,
  "details": [],
  "env_var": null,
  "expires_at": null,
  "id": "Q20",
  "item_version": 1,
  "kind": "question",
  "notes": [],
  "options": [],
  "pipeline": null,
  "pull_request": null,
  "question": "generated by `tac sync` from `.agents/context/brief.md`, as M1 builds it, or hand-written at the root, as DESIGN 2.1 and 2.2 say?",
  "rank": 20,
  "recommendation": "generated. The brief then sits in the lock-guarded `.agents/` tree, a hand edit to `AGENTS.md` is a red `tac check`, and the Codex chain budget is checked on the render. DESIGN 2.1 and 2.2 change to match once answered.",
  "recommendation_source": "from the M1 build, not yet put to the board",
  "revision": null,
  "stage": null,
  "status": "pending",
  "title": "the root `AGENTS.md`",
  "tool": null,
  "topic": "standards",
  "waits": "M1"
}
