{
  "agent": null,
  "answers": [],
  "approval": null,
  "arguments": {},
  "asked_at": "2026-09-24T00:00:00Z",
  "blocks": [],
  "decided_at": null,
  "decided_by": null,
  "details": [],
  "env_var": null,
  "expires_at": null,
  "id": "Q9",
  "item_version": 1,
  "kind": "question",
  "notes": [],
  "options": [],
  "pipeline": null,
  "pull_request": null,
  "question": "the repository is public. Publish TAC under MIT?",
  "rank": 20,
  "recommendation": "MIT. A public MIT repository also keeps unlicensed third-party skill bodies out.",
  "recommendation_source": null,
  "revision": null,
  "stage": null,
  "status": "pending",
  "title": "licence",
  "tool": null,
  "topic": "scope",
  "waits": "the first release"
}
