{
  "agent": null,
  "answers": [],
  "approval": null,
  "arguments": {},
  "asked_at": "2026-09-25T17:41:27Z",
  "blocks": [],
  "decided_at": null,
  "decided_by": null,
  "details": [
    "In your own terminal on the host, never an agent session, with the runner serving: `just dev-proof --live --harness claude`, then `just dev-proof --live --harness codex`, run each C1 and C6 probe through `tac receipt client`; the probe entries of `.agents/config/probes.toml` and `receipts.toml` (follow-up config) land first.",
    "Until this item is answered every Codex probe skips as paused; `just dev-proof` prints the step each other probe still waits on."
  ],
  "env_var": null,
  "expires_at": null,
  "id": "S10",
  "item_version": 1,
  "kind": "step",
  "notes": [],
  "options": [],
  "pipeline": null,
  "pull_request": null,
  "question": "Once Codex is resumed, answer this item; then, after S5, Q24 and S3, run `just dev-proof --require-live` on the host and land `docs/evidence/m4-dev-proof.md` from that run.",
  "rank": 110,
  "recommendation": null,
  "recommendation_source": null,
  "revision": null,
  "stage": null,
  "status": "pending",
  "title": "Acceptance 8, the live part",
  "tool": null,
  "topic": "steps",
  "waits": "M4 (acceptance 8, the live part: C1 and C6 proven live, docs/DESIGN.md sections 13 and 18)"
}
