{
  "agent": null,
  "answers": [],
  "approval": null,
  "arguments": {},
  "asked_at": "2026-09-24T00:00:00Z",
  "blocks": [],
  "decided_at": null,
  "decided_by": null,
  "details": [],
  "env_var": null,
  "expires_at": null,
  "id": "S7",
  "item_version": 1,
  "kind": "step",
  "notes": [],
  "options": [],
  "pipeline": null,
  "pull_request": null,
  "question": "Install the git hooks once, in your own terminal in the main checkout: `just hooks-install`. Agents never write the shared `.git/hooks`. From then on every commit there is held to Q4's subject length.",
  "rank": 70,
  "recommendation": null,
  "recommendation_source": null,
  "revision": null,
  "stage": null,
  "status": "pending",
  "title": null,
  "tool": null,
  "topic": "steps",
  "waits": null
}
