{
  "agent": null,
  "answers": [],
  "approval": null,
  "arguments": {},
  "asked_at": "2026-09-24T00:00:00Z",
  "blocks": [],
  "decided_at": null,
  "decided_by": null,
  "details": [],
  "env_var": null,
  "expires_at": null,
  "id": "Q18",
  "item_version": 1,
  "kind": "question",
  "notes": [],
  "options": [],
  "pipeline": null,
  "pull_request": null,
  "question": "Claude Code and Codex enforced, the standard profile only, with enterprise, yolo, containers and the four other harnesses in release 1.1?",
  "rank": 10,
  "recommendation": "yes. The target is unchanged, and 1.1 starts the day vibe-map adopts release 1.",
  "recommendation_source": null,
  "revision": null,
  "stage": null,
  "status": "pending",
  "title": "release 1 scope",
  "tool": null,
  "topic": "scope",
  "waits": "M0"
}
